{
  "schema_version": "1.0",
  "task_id": "fix-missing-return",
  "task_name": "Fix apply_discount missing return",
  "category": "bug_fix",
  "status": "error",
  "timestamp": "2026-08-16T15:46:40.777154+00:00",
  "runner_version": "0.2.0",
  "driver": "api",
  "provider": null,
  "model": null,
  "workspace": {
    "repo_hash": "f1925223b8cb5bd7",
    "commit": null,
    "baseline": {
      "test_passed": false,
      "test_exit_code": 1,
      "duration_sec": 0.929
    }
  },
  "prompt": "apply_discount(price, percent) in discount.py computes the discounted value but never returns it, so callers always get None. Fix the function so the tests in test_discount.py pass.",
  "metrics": {
    "duration_sec": 318.894,
    "iterations": 10,
    "tokens": 0,
    "cost_usd": 0.0,
    "tools_used": [
      "read_file",
      "str_replace"
    ],
    "test_command": [
      "python3",
      "-m",
      "pytest",
      "-q"
    ],
    "test_passed": false,
    "test_exit_code": 1,
    "test_output": "FF                                                                       [100%]\n=================================== FAILURES ===================================\n_____________________________ test_ten_percent_off _____________________________\n\n    def test_ten_percent_off():\n>       assert apply_discount(100, 10) == 90\nE       assert None == 90\nE        +  where None = apply_discount(100, 10)\n\ntest_discount.py:7: AssertionError\n_______________________________ test_no_discount _______________________________\n\n    def test_no_discount():\n>       assert apply_discount(50, 0) == 50\nE       assert None == 50\nE        +  where None = apply_discount(50, 0)\n\ntest_discount.py:11: AssertionError\n=========================== short test summary info ============================\nFAILED test_discount.py::test_ten_percent_off - assert None == 90\nFAILED test_discount.py::test_no_discount - assert None == 50\n2 failed in 0.03s\n",
    "verification_status": "failed",
    "tokens_in": 0,
    "tokens_out": 0,
    "request_count": 0,
    "cancelled": false
  },
  "final_output": "request timed out after 300s"
}